description,business_tags,sector,category,niche,label
"Paws & Commands is a professional dog training center that offers behavior correction, agility training, and obedience courses for pets. The company employs certified trainers who specialize in both domestic pets and working dogs, providing personalized programs either on-site or at the clients home.","['Dog Training', 'Obedience Classes', 'Behavior Correction', 'Agility Training', 'Pet Behavior Consulting']",Services,Pet Services,Animal Training and Behavior Management,Animal Trainers
"UrbanRevive Interiors offers full renovation services for apartment units, including kitchen remodeling, bathroom upgrades, flooring replacement, and interior painting. They focus on improving property value for landlords and tenants.","['Apartment Remodeling', 'Tenant Improvements', 'Kitchen Renovation', 'Bathroom Upgrades', 'Modern Flooring']",Services,Residential Renovation,Interior Remodeling for Apartment Units,Apartment Renovation Services
"ComNet Installers is a B2B company specializing in the installation of structured cabling and commercial communication systems, including VoIP networks, intercom systems, and fiber optic lines. They serve business parks, retail chains, and hospitals.","['VoIP Installation', 'Fiber Optic Setup', 'Structured Cabling', 'Commercial Intercoms', 'Business Communication Systems']",Services,Telecommunications Installation,Business Communication Equipment Integration,Commercial Communication Equipment Installation
"DrainForce Industrial Services offers high-capacity drain cleaning and hydro-jetting for commercial buildings, restaurants, and factories. They specialize in grease line clearing, sewer maintenance, and preventive plumbing programs.","['Hydro-Jetting', 'Commercial Plumbing', 'Grease Trap Cleaning', 'Sewer Line Maintenance', 'Preventive Drain Programs']",Services,Commercial Plumbing & Utilities,Drain and Sewer Cleaning for Commercial Properties,Commercial Drain Cleaning
"PipeMaster Commercial Plumbing specializes in large-scale plumbing projects for office buildings, shopping centers, and industrial facilities. Their services include pipe installation, backflow prevention systems, water heater connections, and emergency repair contracts.","['Commercial Plumbing', 'Pipe Installation', 'Water Systems', 'Backflow Prevention', 'Industrial Facilities Plumbing']",Services,Building Maintenance Services,Plumbing Installation and Repair for Commercial Clients,Commercial Plumbing Services
"SnowShield Commercial provides large-scale snow clearing services for retail centers, office parks, industrial complexes, and municipal zones. Their fleet includes plows, blowers, and salt spreaders for 24/7 storm response.","['Parking Lot Snow Removal', 'Salt Spreading', 'Storm Monitoring', 'Commercial Property Clearing', 'Plowing Services']",Services,Facility Maintenance,Snow Removal for Commercial Properties,Commercial Snow Removal
"MoveMax Engineering designs and installs custom conveyor systems for warehouses, packaging plants, and distribution centers. They specialize in belt-driven, roller, and modular systems for material handling automation.","['Belt Conveyor Setup', 'Automated Sorting Lines', 'Material Handling Systems', 'Roller Conveyor Installation', 'Industrial Logistics Equipment']",Manufacturing,Industrial Automation,Conveyor Design and Installation for Logistics Facilities,Conveyor System Installation
"Artisan Spirits Co. is a small-batch distillery that offers distillation services for third-party beverage companies. They specialize in craft gins, vodkas, and experimental spirits using copper stills and traditional methods. Clients include startup alcohol brands and specialty producers.","['Craft Distillation', 'Spirit Formulation', 'White Label Distilling', 'Copper Still Equipment', 'Gin and Vodka Production']",Manufacturing,Beverage Production,Artisanal Distilling and Alcohol Manufacturing Services,Distilling Services
"MarineBase Builders provides design and construction services for residential and commercial docks, floating piers, and boat access platforms. They use corrosion-resistant materials and also offer permit acquisition assistance.","['Dock Construction', 'Floating Pier Installation', 'Marine Structures', 'Boat Platforms', 'Waterfront Access Engineering']",Services,Marine and Waterfront Construction,Dock and Pier Building Services,Dock and Pier Construction
"VoltLine Construction is a utility infrastructure firm that specializes in building overhead and underground electric lines for new residential developments, commercial parks, and municipal projects. The company is certified for high-voltage distribution systems.","['Electric Utility Lines', 'Power Distribution Installation', 'Overhead Cabling', 'Underground Wiring', 'New Site Electrical Construction']",Services,Utility Infrastructure,Electric Line Installation and Grid Connection,Electric Line Construction
"GreenPulse Environmental delivers consulting and monitoring services related to environmental health and pollution risk. Their offerings include air quality monitoring, hazardous waste assessment, and ecological compliance audits.","['Air Pollution Monitoring', 'Environmental Compliance', 'Toxic Waste Assessment', 'Ecological Impact Reports', 'Health Risk Evaluation']",Services,Environmental Consulting,Environmental Health and Pollution Control Services,Environmental Health Services
"HandyPro Solutions is a local business offering on-demand handyman services for small residential and office repairs. Their team handles furniture assembly, drywall patching, leaky faucets, curtain rod mounting, and minor electrical tasks.","['Furniture Assembly', 'Wall Repair', 'Minor Plumbing', 'Fixture Installation', 'General Maintenance']",Services,Home and Office Support,On-Demand Handyman and Repair Services,General Handyman Services
"ArcticEdge Snow Services provides snow plowing and removal for both residential and commercial clients. Their operations include 24/7 emergency clearing, parking lot salting, and snow hauling contracts for cities.","['Snow Plowing', 'Parking Lot Clearing', 'Emergency Snow Response', 'Municipal Contracts', 'Commercial Snow Services']",Services,Seasonal Maintenance,Comprehensive Snow Removal Solutions,General Snow Removal Services
"AgroTech Installers is a specialized company that offers installation services for grain elevators, augers, conveyors, and grain dryers in agricultural facilities. They provide end-to-end support including site preparation, system integration, and maintenance planning for large-scale farms and cooperatives.","['Grain Elevator Setup', 'Conveyor System Installation', 'Auger Assembly', 'Agricultural Equipment Services', 'Farm Infrastructure Installation']",Services,Agricultural Engineering Services,Grain Handling Systems Installation,Grain Handling Machinery Installation
"Safeguard Compliance Advisors provides health and safety auditing, policy development, and employee training for organizations in construction, manufacturing, and logistics. Their consultants are certified in OSHA and ISO standards.","['Workplace Safety Audits', 'OSHA Compliance', 'ISO 45001 Consulting', 'Employee Safety Training', 'Hazard Identification Services']",Services,Occupational Safety and Compliance,Workplace Health and Safety Advisory Services,Health and Safety Consulting
"DeepCore Foundations provides structural excavation and foundation services for high-rise buildings in urban areas. Their projects include pile driving, caisson drilling, and subgrade waterproofing.","['Deep Excavation', 'Pile Foundations', 'Caisson Drilling', 'Structural Base Preparation', 'Urban Construction Foundations']",Services,Structural Engineering,Foundation Construction for High-Rise Structures,High-Rise Foundation Construction
"SkyGlaze Fasade Systems is a glazing contractor that specializes in the installation of architectural glass for high-rise buildings. Their projects include curtain walls, insulated glazing units, and impact-resistant facades for commercial towers.","['Curtain Wall Systems', 'Glass Panel Installation', 'Skyscraper Façade Glazing', 'Insulated Glass', 'High-Rise Construction Services']",Services,Specialty Contracting,Architectural Glass Installation for High-Rise Structures,High-Rise Glass Installation
SkySign Installers provides professional installation services for illuminated and non-illuminated signs on tall buildings and skyscrapers. They use certified high-access rigging teams and comply with city ordinances.,"['Building Signage Mounting', 'LED Sign Installation', 'High-Access Teams', 'Commercial Tower Branding', 'Urban Sign Compliance']",Services,Commercial Branding & Advertising,Skyscraper and High-Rise Signage Services,High-Rise Signage Installation
"Staged to Sell Interiors offers home staging and visual redesign services aimed at real estate agents and homeowners preparing properties for sale. Their team optimizes interior layouts using rented furniture, lighting, and décor to increase perceived value.","['Home Staging', 'Real Estate Interiors', 'Property Styling', 'Furniture Rental for Staging', 'Interior Optimization']",Services,Real Estate Support Services,Residential Home Staging and Preparation for Sale,Home Staging Services
"AirCheck Experts offers diagnostic inspections for HVAC systems to identify efficiency issues, leaks, or safety risks. Services include airflow testing, duct inspections, and energy audit reports.","['HVAC Diagnostics', 'Energy Efficiency Audits', 'Duct Leakage Testing', 'Airflow Measurement', 'Heating and Cooling System Assessment']",Services,Mechanical Inspections,HVAC System Performance Evaluation,HVAC Inspections
"KlimaTech Solutions is a heating, ventilation, and air conditioning (HVAC) company that installs and services residential and commercial climate systems. They offer air conditioning unit replacement, furnace repair, and maintenance contracts for large facilities.","['Air Conditioner Installation', 'Furnace Repair', 'HVAC Maintenance Plans', 'Ventilation Systems', 'Residential and Commercial HVAC']",Services,Mechanical Services,"Heating, Ventilation and Air Conditioning",HVAC Installation and Service
"GradeMaster Earthworks provides precision land leveling for agriculture, construction, and landscaping projects. They use laser-guided equipment for optimal surface balance, drainage planning, and erosion control.","['Land Grading', 'Laser Leveling', 'Site Preparation', 'Drainage Planning', 'Erosion Prevention']",Services,Earthwork Services,Site Leveling and Surface Optimization,Land Leveling Services
"SignPlus Installs specializes in sign mounting for low-rise commercial buildings, shops, and office plazas. Services include illuminated signs, storefront lettering, and wall-mounted directories.","['LED Signs', 'Acrylic Lettering', 'Wall Signage Installation', 'Retail Signage Solutions', 'Business Identity Mounting']",Services,Business Support & Branding,Signage Solutions for Low-Rise Businesses,Low-Rise Signage Installation
"MediPipe Systems installs and certifies medical gas delivery infrastructure in hospitals, dental clinics, and surgical centers. Their technicians are trained in oxygen, nitrous oxide, vacuum, and air systems per national standards.","['Oxygen Line Installation', 'Vacuum System Setup', 'Medical Gas Compliance', 'Surgical Air Systems', 'Dental Facility Infrastructure']",Services,Medical Infrastructure,Installation and Certification of Medical Gas Systems,Medical Gas Installation Services
"EarthMovers Ltd. specializes in site preparation and excavation for new developments, including digging for foundations, utilities, and drainage systems. The company works with residential and commercial builders.","['Site Grading', 'Trenching', 'Foundation Excavation', 'Construction Site Prep', 'Heavy Equipment Operations']",Services,Earthworks and Site Preparation,Excavation Services for Undeveloped Land,New Ground Excavation
"PipePath Contractors installs underground utility pipelines for new construction projects, including water, gas, and sewage lines. They handle trenching, pipe laying, pressure testing, and site restoration.","['Underground Pipeline Laying', 'Trenching Services', 'Water and Gas Lines', 'Utility Infrastructure', 'Sewer System Installation']",Services,Infrastructure Construction,Pipeline Installation for Undeveloped Sites,New Ground Pipeline Installation
"FormTech Fabricators specializes in the production of non-structural steel components such as stairs, railings, brackets, and light framing. They offer custom fabrication for construction and interior fit-out contractors.","['Custom Steel Railings', 'Staircase Frames', 'Metal Bracket Fabrication', 'Light Gauge Steel', 'Interior Metalwork']",Manufacturing,Metal Fabrication,Light and Decorative Steel Component Production,Non-Structural Steel Fabrication
"SafeWork Clinics provides occupational health screening and preventative care for industrial and corporate clients. Their services include physical exams, drug testing, respiratory evaluations, and ergonomic consultations for employees.","['Workplace Health Exams', 'Occupational Screening', 'Ergonomics Consulting', 'Drug Testing', 'Employee Wellness Services']",Services,Healthcare & Wellness,Occupational Medical and Preventative Services,Occupational Health Services
"GreenBloom Nurseries is a family-owned business that specializes in cultivating and selling a wide variety of ornamental plants, including flowering shrubs, decorative trees, and seasonal flowers. Located on a 15-acre farm, the nursery offers custom landscaping advice and direct plant sales to residential and commercial clients.","['Ornamental Plants', 'Flowering Shrubs', 'Tree Nursery', 'Seasonal Plants', 'Landscaping Support']",Services,Gardening and Landscaping,Ornamental Plant Cultivation and Distribution,Ornamental Plant Nurseries
"PreconForm specializes in the on-site assembly and installation of precast concrete elements for commercial and residential projects. Their team handles walls, floors, stairs, and façade components using crane-assisted mounting techniques.","['Precast Walls', 'Concrete Panel Assembly', 'Construction Mounting Services', 'Crane Installation', 'Structural Precast Elements']",Services,Structural Installation,Precast Concrete Components Placement,Precast Concrete Installation
"AssurePlus QA Group provides third-party quality assurance services for manufacturing and logistics operations. Their offerings include product inspections, process audits, supplier assessments, and compliance reporting.","['Product Inspection', 'Supplier Audits', 'Manufacturing QA', 'ISO 9001 Compliance', 'Process Validation']",Services,Operational Compliance,Quality Assurance and Risk Mitigation Services,Quality Assurance Services
"CleanFlow Plumbing offers residential drain cleaning and unblocking services using mechanical snakes, hydro-jetting, and inspection cameras. Available for emergency visits and routine maintenance contracts.","['Drain Unclogging', 'Hydro-Jetting', 'Camera Inspection', 'Residential Plumbing Services', 'Emergency Drain Cleaning']",Services,Home Plumbing,Clog Removal and Preventive Drain Maintenance,Residential Drain Cleaning
"DrainWise Homes designs and installs residential drainage systems, including French drains, surface grading, gutter downspout redirection, and basement waterproofing solutions to prevent flooding and soil erosion.","['French Drain Installation', 'Gutter Redirection', 'Foundation Drainage', 'Basement Waterproofing', 'Yard Grading']",Services,Residential Infrastructure,Drainage and Flood Protection for Homes,Residential Drainage Systems
"DrivePro Builders focuses on residential driveway installation using asphalt, concrete, and paving stones. The company offers demolition of old driveways, site grading, and full construction including decorative finishes. They serve clients in suburban and rural areas.","['Asphalt Driveways', 'Concrete Pouring', 'Residential Grading', 'Decorative Pavers', 'Driveway Resurfacing']",Services,Residential Infrastructure Services,Driveway and Entryway Construction,Residential Driveway Construction
"SnowAway Home Services provides prompt and affordable snow removal solutions for residential neighborhoods. Their team offers driveway and walkway clearing, salting, and seasonal contracts to homeowners and HOAs.","['Snow Shoveling', 'Driveway Clearing', 'Sidewalk Salting', 'Winter Maintenance', 'Residential Snow Contracts']",Services,Property Maintenance,Snow Removal Services for Homes,Residential Snow Removal
HeatSeal Roofing installs torch-applied roofing membranes for flat roofs on commercial and industrial buildings. Their heat-applied systems ensure water resistance and durability in harsh climates.,"['Torch-On Roof Installation', 'Bitumen Roofing Systems', 'Flat Roof Waterproofing', 'Commercial Roof Heat Sealing', 'Industrial Roof Durability']",Services,Commercial Roofing,Heat-Applied Roofing Membranes and Installation,Roofing Services with Heat Application
"AgriSelect Processing provides post-harvest seed cleaning, sorting, treating, and packaging services for grain and vegetable seed producers. They use modern sorting equipment and offer optional biological seed coatings.","['Seed Cleaning', 'Seed Grading', 'Seed Coating', 'Bulk Seed Packaging', 'Post-Harvest Services']",Manufacturing,Agricultural Processing,Seed Treatment and Conditioning Services,Seed Processing Services
"Rankify Digital is a boutique SEO agency that helps small and medium-sized businesses improve their online visibility through search engine optimization. Services include keyword research, on-page optimization, backlink building, and SEO audits.","['SEO Strategy', 'Keyword Optimization', 'Link Building', 'Technical SEO', 'Search Engine Audits']",Services,Digital Marketing,Search Engine Optimization Consulting,SEO Services
"RenoCraft Homes specializes in renovating single-family homes, offering kitchen and bathroom remodeling, flooring replacement, interior wall reconfiguration, and energy-efficient window upgrades.","['Kitchen Remodeling', 'Bathroom Upgrades', 'Home Energy Efficiency', 'Interior Renovation', 'Floor and Window Replacement']",Services,Residential Renovation,,Single Family Renovation Services
"PrimeHouse Builders constructs custom single-family homes, offering design-build services, foundation work, framing, roofing, and final finishing. They manage full residential projects from permit to keys.","['Custom Home Building', 'Foundation to Finish', 'Permit Management', 'Wood Framing', 'Turnkey Residential Projects']",Services,Residential Construction,Single-Family Home Development,Single Family Residential Construction
"NaturEssence Soaps is a manufacturer of natural and organic soap products for private labels and small retailers. Their facility handles the full process from formulation to packaging, focusing on artisanal cold-process soaps using eco-friendly ingredients.","['Cold Process Soap', 'Organic Soap Production', 'Custom Soap Formulation', 'Private Label Manufacturing', 'Natural Skincare Ingredients']",Manufacturing,Cosmetics and Personal Care,Soap and Skincare Product Manufacturing,Soap Production Services
"ConnectImpact Group offers stakeholder engagement services for companies involved in infrastructure, sustainability, or community development projects. They facilitate consultations, impact assessments, and reporting for NGOs and local governments.","['Public Consultations', 'Stakeholder Mapping', 'Community Engagement Plans', 'Sustainability Dialogue', 'Impact Reporting']",Services,Strategic Communication & Governance,Stakeholder Relations and Community Engagement Services,Stakeholder Services
"SteamFlow Solutions offers industrial steam system installation, maintenance, and monitoring for manufacturing plants and large-scale facilities. Their services include boiler tuning, steam trap inspection, and pipe insulation.","['Steam System Maintenance', 'Boiler Services', 'Steam Trap Testing', 'Industrial Piping', 'Thermal Efficiency Optimization']",Services,Industrial Utilities Management,Steam Distribution and Efficiency Services,Steam Services
"SteelRise Erectors is a construction subcontractor that assembles structural steel frameworks for commercial and industrial buildings. Their services include column placement, beam welding, joist installation, and bracing systems.","['Steel Frame Installation', 'Structural Beam Erection', 'Joist Placement', 'Welding Services', 'Construction Support']",Services,Structural Engineering Services,Steel Structure Assembly for Large Buildings,Structural Steel Erection
"BlueWave PoolCare provides full-service swimming pool maintenance for residential clients, including chemical balancing, vacuuming, filter cleaning, and seasonal pool opening and closing.","['Pool Cleaning', 'Chemical Treatment', 'Filter Servicing', 'Residential Pools', 'Seasonal Maintenance Contracts']",Services,Home Maintenance,Routine Pool Upkeep for Residential Properties,Swimming Pool Maintenance Services
"TiltForce Construction offers tilt-up concrete panel design, casting, and lifting services for commercial warehouses and logistic centers. Their team uses rapid assembly techniques that reduce construction time and labor costs.","['Tilt-Up Panels', 'Concrete Casting', 'Panel Lifting', 'Commercial Shell Construction', 'Fast Track Building']",Services,Commercial Building Techniques,Tilt-Up Panel Construction for Warehouses,Tilt-Up Concrete Services
"TrimCraft Industries manufactures interior and exterior trim products, including baseboards, moldings, cornices, and decorative wood panels. They serve home improvement retailers and custom builders with both stock and custom trim profiles.","['Baseboard Manufacturing', 'Crown Moldings', 'Decorative Trim', 'Wood Panel Profiles', 'Custom Carpentry Components']",Manufacturing,Wood Product Manufacturing,Interior and Exterior Trim Production,Trim Manufacturing
"TerraClear Solutions offers property maintenance and clearance services for undeveloped land plots. Their services include debris removal, grading, invasive plant management, and security fencing installation. Clients include real estate developers and municipalities.","['Land Clearing', 'Vacant Lot Maintenance', 'Brush Removal', 'Security Fencing', 'Pre-Development Site Prep']",Services,Land Management,Maintenance Services for Unbuilt Property,Vacant Land Services
"PaveMax Contractors specializes in constructing high-durability driveways for retail centers, hospitals, and corporate campuses. Their team offers grading, concrete or asphalt pouring, and line marking for heavy traffic areas.","['Commercial Paving', 'Heavy-Duty Asphalt', 'Driveway Striping', 'Concrete Surface Prep', 'Retail Property Services']",Services,Commercial Infrastructure Services,High-Traffic Driveway Construction,Commercial Driveway Construction
"HomeNet Installers provides structured cabling, Wi-Fi system setup, and smart home communication equipment installation for single-family homes and small apartment buildings.","['Home Networking', 'Structured Cabling', 'Wi-Fi Setup', 'Voice and Data', 'Home Tech Installation']",Services,Residential IT Services,Communication System Setup for Homes,Residential Communication Equipment Installation
"ClearPane Glassworks installs windows and doors in low-rise buildings, including storefronts, offices, and small apartment blocks. Their services include tempered glass fitting and weather sealing.","['Glass Door Installation', 'Storefront Windows', 'Tempered Glass Panels', 'Low-Rise Buildings', 'Sealant Application']",Services,Windows and Doors Services,Glass Installation for Small Structures,Low-Rise Glass Installation
"MachinoTech Services provides installation and setup of heavy industrial machines, including production lines, presses, and robotic arms. Their engineers specialize in alignment, anchoring, and system integration.","['Machine Assembly', 'Industrial Equipment Setup', 'Production Line Integration', 'Heavy Machinery Installation', 'Equipment Anchoring']",Services,Industrial Engineering,Machinery Installation for Factories,Industrial Machinery Installation
"BaseLine Construction Co. focuses on foundation work for low-rise residential and commercial structures. Services include site excavation, formwork, rebar installation, and concrete pouring.","['Foundation Pouring', 'Rebar Placement', 'Excavation', 'Concrete Base Construction', 'Low-Rise Site Work']",Services,Structural Foundations,Concrete Foundation for Small Buildings,Low-Rise Foundation Construction
"SecureSpace Property Services manages vacant buildings for real estate owners, providing inspection, light maintenance, alarm system monitoring, and seasonal upkeep to preserve property value.","['Vacancy Management', 'Alarm Monitoring', 'Property Inspections', 'Seasonal Upkeep', 'Security Patrols']",Services,Real Estate Support,Maintenance and Monitoring of Vacant Buildings,Vacant Building Management
"TechAdvise Group offers technology strategy consulting for SMEs, helping businesses adopt cloud solutions, optimize workflows, and implement secure IT systems to scale operations.","['Cloud Strategy', 'Workflow Optimization', 'IT Risk Management', 'System Integration', 'Digital Transformation']",Services,IT & Business Consulting,Digital and Technology Strategy Consulting,Technology Consulting
"WellnessImpact offers programs and workshops that promote healthy lifestyles in corporate and school environments, covering topics such as nutrition, exercise, stress reduction, and preventive health.","['Workplace Wellness', 'Health Campaigns', 'Nutrition Education', 'Stress Management', 'Fitness Programs']",Services,Public Health & Wellness,Preventive Health and Lifestyle Education,Health Promotion Services
